{
  "$schema": "https://json-schema.org/draft/2020-12/schema",
  "$id": "https://github.com/HoriSift/HoriSift/blob/main/schemas/rules-report.v1.schema.json",
  "title": "HoriSift rules catalog report v1",
  "type": "object",
  "additionalProperties": false,
  "required": [
    "schemaVersion",
    "toolVersion",
    "ruleSetVersion",
    "rules"
  ],
  "properties": {
    "schemaVersion": {
      "const": "1.0.0"
    },
    "toolVersion": {
      "type": "string",
      "pattern": "^[0-9]+\\.[0-9]+\\.[0-9]+(?:-[a-zA-Z0-9.-]+)?$"
    },
    "ruleSetVersion": {
      "const": "1.0.0"
    },
    "rules": {
      "type": "array",
      "minItems": 25,
      "maxItems": 25,
      "items": {
        "type": "object",
        "required": [
          "id",
          "version",
          "name",
          "detectionKind",
          "matchTarget",
          "mappingKind",
          "rpcMethods",
          "severity",
          "confidence",
          "recommendation",
          "officialSources",
          "limitations"
        ],
        "additionalProperties": false,
        "properties": {
          "id": {
            "type": "string",
            "maxLength": 180
          },
          "version": {
            "type": "string",
            "maxLength": 100
          },
          "name": {
            "type": "string",
            "maxLength": 180
          },
          "detectionKind": {
            "enum": [
              "sdk-client",
              "sdk-call",
              "http-call",
              "stream",
              "response-shape"
            ]
          },
          "matchTarget": {
            "type": "string",
            "maxLength": 200
          },
          "mappingKind": {
            "enum": [
              "direct",
              "conditional",
              "indexer-required",
              "no-direct-rpc-equivalent",
              "unknown"
            ]
          },
          "rpcMethods": {
            "type": "array",
            "maxItems": 20,
            "items": {
              "type": "string",
              "maxLength": 90
            }
          },
          "severity": {
            "enum": [
              "info",
              "low",
              "medium",
              "high"
            ]
          },
          "confidence": {
            "enum": [
              "high",
              "medium",
              "unknown"
            ]
          },
          "recommendation": {
            "type": "string",
            "maxLength": 1000
          },
          "officialSources": {
            "type": "array",
            "minItems": 1,
            "maxItems": 6,
            "items": {
              "$ref": "#/$defs/source"
            }
          },
          "limitations": {
            "type": "array",
            "minItems": 1,
            "maxItems": 12,
            "items": {
              "type": "string",
              "maxLength": 1000
            }
          }
        }
      }
    }
  },
  "$defs": {
    "source": {
      "type": "object",
      "required": [
        "url",
        "checkedDate",
        "note"
      ],
      "additionalProperties": false,
      "properties": {
        "url": {
          "type": "string",
          "pattern": "^https://developers\\.stellar\\.org/"
        },
        "checkedDate": {
          "type": "string",
          "pattern": "^[0-9]{4}-[0-9]{2}-[0-9]{2}$"
        },
        "note": {
          "type": "string",
          "maxLength": 400
        }
      }
    }
  }
}
