{"schemaVersion":"1.0.0","toolVersion":"0.1.0-rc.1","ruleSetVersion":"1.0.0","rules":[{"id":"horizon.http.ledger-list","version":"1.0.0","name":"Ledger listing","detectionKind":"http-call","matchTarget":"http.GET./ledgers","mappingKind":"direct","rpcMethods":["getLedgers"],"severity":"medium","confidence":"high","recommendation":"Use RPC getLedgers for the available recent ledger range; build an indexer for full history.","officialSources":[{"url":"https://developers.stellar.org/docs/data/apis/migrate-from-horizon-to-rpc","checkedDate":"2026-10-09","note":"Official endpoint-mapping table and classic event warning; page last updated 2026-08-18."},{"url":"https://developers.stellar.org/docs/data/apis/rpc","checkedDate":"2026-10-09","note":"RPC is not a Horizon drop-in or historical indexer; recent history window is provider-dependent."}],"limitations":["RPC retains only a bounded recent history window (around seven days by default, provider-dependent).","Horizon REST/HAL and RPC JSON-RPC response schemas differ; investigate data shape and application behavior."]},{"id":"horizon.http.ledger-detail","version":"1.0.0","name":"Ledger by sequence","detectionKind":"http-call","matchTarget":"http.GET./ledgers/:id","mappingKind":"direct","rpcMethods":["getLedgers"],"severity":"medium","confidence":"high","recommendation":"Filter RPC getLedgers by ledger sequence, checking that the ledger remains in the provider history window.","officialSources":[{"url":"https://developers.stellar.org/docs/data/apis/migrate-from-horizon-to-rpc","checkedDate":"2026-10-09","note":"Official endpoint-mapping table and classic event warning; page last updated 2026-08-18."},{"url":"https://developers.stellar.org/docs/data/apis/rpc","checkedDate":"2026-10-09","note":"RPC is not a Horizon drop-in or historical indexer; recent history window is provider-dependent."}],"limitations":["RPC retains only a bounded recent history window (around seven days by default, provider-dependent).","Horizon REST/HAL and RPC JSON-RPC response schemas differ; investigate data shape and application behavior."]},{"id":"horizon.http.transaction-submit","version":"1.0.0","name":"Transaction submission","detectionKind":"http-call","matchTarget":"http.POST./transactions","mappingKind":"direct","rpcMethods":["sendTransaction"],"severity":"medium","confidence":"high","recommendation":"Review sendTransaction submission semantics and track final transaction status as needed; do not assume identical response or status lifecycle.","officialSources":[{"url":"https://developers.stellar.org/docs/data/apis/migrate-from-horizon-to-rpc","checkedDate":"2026-10-09","note":"Official endpoint-mapping table and classic event warning; page last updated 2026-08-18."},{"url":"https://developers.stellar.org/docs/data/apis/rpc","checkedDate":"2026-10-09","note":"RPC is not a Horizon drop-in or historical indexer; recent history window is provider-dependent."}],"limitations":["Horizon REST/HAL and RPC JSON-RPC response schemas differ; investigate data shape and application behavior.","Submitting is distinct from observing final inclusion or success."]},{"id":"horizon.http.transaction-by-hash","version":"1.0.0","name":"Transaction lookup by hash","detectionKind":"http-call","matchTarget":"http.GET./transactions/:id","mappingKind":"direct","rpcMethods":["getTransaction"],"severity":"medium","confidence":"high","recommendation":"Query getTransaction by hash for retained history; handle unavailable or not-yet-indexed transaction outcomes.","officialSources":[{"url":"https://developers.stellar.org/docs/data/apis/migrate-from-horizon-to-rpc","checkedDate":"2026-10-09","note":"Official endpoint-mapping table and classic event warning; page last updated 2026-08-18."},{"url":"https://developers.stellar.org/docs/data/apis/rpc","checkedDate":"2026-10-09","note":"RPC is not a Horizon drop-in or historical indexer; recent history window is provider-dependent."}],"limitations":["RPC retains only a bounded recent history window (around seven days by default, provider-dependent).","Horizon REST/HAL and RPC JSON-RPC response schemas differ; investigate data shape and application behavior."]},{"id":"horizon.http.account-detail","version":"1.0.0","name":"Account ledger entry","detectionKind":"http-call","matchTarget":"http.GET./accounts/:id","mappingKind":"conditional","rpcMethods":["getLedgerEntries"],"severity":"medium","confidence":"high","recommendation":"Use getLedgerEntries for the account ledger entry, and separately derive its trustlines and other Horizon-composed fields.","officialSources":[{"url":"https://developers.stellar.org/docs/data/apis/migrate-from-horizon-to-rpc","checkedDate":"2026-10-09","note":"Official endpoint-mapping table and classic event warning; page last updated 2026-08-18."},{"url":"https://developers.stellar.org/docs/data/apis/rpc","checkedDate":"2026-10-09","note":"RPC is not a Horizon drop-in or historical indexer; recent history window is provider-dependent."}],"limitations":["Horizon REST/HAL and RPC JSON-RPC response schemas differ; investigate data shape and application behavior.","RPC account entry excludes trustline data that Horizon joins."]},{"id":"horizon.http.account-list","version":"1.0.0","name":"Account enumeration","detectionKind":"http-call","matchTarget":"http.GET./accounts","mappingKind":"indexer-required","rpcMethods":[],"severity":"high","confidence":"high","recommendation":"Build or use a historical account index; the RPC API has no direct account-list equivalent.","officialSources":[{"url":"https://developers.stellar.org/docs/data/apis/migrate-from-horizon-to-rpc","checkedDate":"2026-10-09","note":"Official endpoint-mapping table and classic event warning; page last updated 2026-08-18."},{"url":"https://developers.stellar.org/docs/data/apis/rpc","checkedDate":"2026-10-09","note":"RPC is not a Horizon drop-in or historical indexer; recent history window is provider-dependent."}],"limitations":["RPC retains only a bounded recent history window (around seven days by default, provider-dependent).","RPC does not maintain Horizon account-list indexes."]},{"id":"horizon.http.operation-list","version":"1.0.0","name":"Operation history listing","detectionKind":"http-call","matchTarget":"http.GET./operations","mappingKind":"indexer-required","rpcMethods":["getTransactions"],"severity":"high","confidence":"high","recommendation":"Ingest transactions/ledgers and decode XDR to build a searchable operations view, especially for history.","officialSources":[{"url":"https://developers.stellar.org/docs/data/apis/migrate-from-horizon-to-rpc","checkedDate":"2026-10-09","note":"Official endpoint-mapping table and classic event warning; page last updated 2026-08-18."},{"url":"https://developers.stellar.org/docs/data/apis/rpc","checkedDate":"2026-10-09","note":"RPC is not a Horizon drop-in or historical indexer; recent history window is provider-dependent."}],"limitations":["RPC retains only a bounded recent history window (around seven days by default, provider-dependent).","getTransactions is not an operations-list drop-in."]},{"id":"horizon.http.operation-by-id","version":"1.0.0","name":"Operation by Horizon ID","detectionKind":"http-call","matchTarget":"http.GET./operations/:id","mappingKind":"no-direct-rpc-equivalent","rpcMethods":[],"severity":"high","confidence":"high","recommendation":"Keep an indexed mapping from Horizon operation IDs to ledger/transaction positions and retrieve/decode the relevant transaction.","officialSources":[{"url":"https://developers.stellar.org/docs/data/apis/migrate-from-horizon-to-rpc","checkedDate":"2026-10-09","note":"Official endpoint-mapping table and classic event warning; page last updated 2026-08-18."},{"url":"https://developers.stellar.org/docs/data/apis/rpc","checkedDate":"2026-10-09","note":"RPC is not a Horizon drop-in or historical indexer; recent history window is provider-dependent."}],"limitations":["RPC retains only a bounded recent history window (around seven days by default, provider-dependent).","RPC does not directly look up a Horizon operation ID."]},{"id":"horizon.http.payments-list","version":"1.0.0","name":"Payment history","detectionKind":"http-call","matchTarget":"http.GET./payments","mappingKind":"conditional","rpcMethods":["getEvents","getTransactions"],"severity":"high","confidence":"high","recommendation":"Review CAP-67 asset event coverage and transaction meta XDR; index history when needed.","officialSources":[{"url":"https://developers.stellar.org/docs/data/apis/migrate-from-horizon-to-rpc","checkedDate":"2026-10-09","note":"Official endpoint-mapping table and classic event warning; page last updated 2026-08-18."},{"url":"https://developers.stellar.org/docs/data/apis/rpc","checkedDate":"2026-10-09","note":"RPC is not a Horizon drop-in or historical indexer; recent history window is provider-dependent."}],"limitations":["RPC retains only a bounded recent history window (around seven days by default, provider-dependent).","Classic asset events require EMIT_CLASSIC_EVENTS=true; pre-Protocol-23 history may additionally require BACKFILL_STELLAR_ASSET_EVENTS=true. Other effects require transaction meta XDR.","Horizon REST/HAL and RPC JSON-RPC response schemas differ; investigate data shape and application behavior."]},{"id":"horizon.http.effects-list","version":"1.0.0","name":"Effect history","detectionKind":"http-call","matchTarget":"http.GET./effects","mappingKind":"conditional","rpcMethods":["getEvents","getTransactions"],"severity":"high","confidence":"high","recommendation":"Combine supported classic events with transaction meta XDR and indexing for other Horizon effect types.","officialSources":[{"url":"https://developers.stellar.org/docs/data/apis/migrate-from-horizon-to-rpc","checkedDate":"2026-10-09","note":"Official endpoint-mapping table and classic event warning; page last updated 2026-08-18."},{"url":"https://developers.stellar.org/docs/data/apis/rpc","checkedDate":"2026-10-09","note":"RPC is not a Hor